,tweets_cleaned,Topic,compound_sentiment
0,similar like uganda mani countri includ india australia newzealand ban twitter whatsapp protect citizen bigtech propaganda,4,-0.128
1,trust idea master ye improvis techniqu live onlin act class call get free act class whatsapp http co ijjl q,9,0.765
2,alcohol consumpt smoke tremend side effect use hard earn money buy trash total wast time money health whatsapp,7,-0.1027
3,vijayshekhar sir u ur team add extra featur like chat voic call video call etc like whatsapp give user becoz paytm million user kyc also good suggest side madeinindia makeinindia,7,0.7845
4,whatsapp add biometr authent web desktop version move back whatsapp whatsapp signal whatsappbiometr http co wvejkhcydu,0,0.0
5,realiti whatsapp user reveng facebook facebook adopt whatsapp meddl privaci polici user flock telegram signal app user would love leav facebook sooner find altern http co ufr pc ob via kashmirwatch,1,0.7096
6,secur privaci first prioriti mobil user stay secur everyon whatsappprivaci signal whatsapp http co ghuy bozon,0,0.0
7,someon watch whatsappstatu whatsapp whatsapp headquart http co bpkv ramx,0,0.0
8,whatsapp whatsapp statu whatsapp http co bmcugkpfpr,0,0.0
9,use watusi io fouadraheb add new featur whatsapp messeng http co zyd dzjq,5,0.0
10,rt ssrajputinc call record whatsapp,7,0.0
11,use watusi io fouadraheb add new featur whatsapp messeng http co xi zl bkev,5,0.0
12,rt kerl whatsapp whatsappstatu share updat sinc notic mani move telegram social,0,0.296
13,rt hindu transcript whatsapp messag intercept via former barc ceo pratho dasgupta phone run,0,0.0
14,drbiden ebook eritt ghostwritt http co nnqf cmwt whatsapp orlumassacr breakingnew burna endsar igoho ronaldo quattromob republicday tuesdayvib tuesdaymotiv pakvssa farmersprotest godimedia happyrepublicday,0,0.0
15,sure love data mine app use whatsapp whatsapp,1,0.7579
16,nypd pornograph photo facebook instagram twitter youtub video whatsapp tictok,1,0.0
17,rt tavonmand world dark forgotten thepromisedsaviour whatsapp,1,-0.2263
18,waterfal spring frozen zarghoon mountain rang near quetta due sever cold balochistan turkey whatsapp khan http co zzwkfyncm,0,0.0
19,rt ladyvelvet hfq sheep follow order take slaughterhous whatsapp twitter facebook instagra,1,0.0
20,privaci myth whatsappprivaci whatsapp,8,0.0
21,facebook send new term condit whatsapp user facebook whatsapp techsaala http co cveqfwu k,1,0.0
22,whatsapp safe quit watch newstrack rahulkanw pm miss promo http co zp tteacgh,1,0.3182
23,helloimdda whatsapp never appli rule india watch http co gymurffcuf signalapp whatsappprivacypolici whatsappnewpolici,1,0.0
24,india signal fever make dent whatsapp million user base http co nhswheveok,7,0.0
25,rt threatpost whatsapp ask user accept new privaci polici share data facebook begin feb,1,0.5859
26,rt fsftamilnadu whatsapp updat term servic privaci polici import privaci affect term note upda,1,0.0
27,make new year resolut busi one thing walk toward quit anoth let help take step today visit http co zxjmwwxuu find reach x audienc whatsapp whatsapp bulkmessag newyear,1,0.4215
28,rt privacyint whatsapp updat term forc user share data facebook suggest updat,1,0.296
29,rt indiatoday recent whatsapp user rais secur issu updat privaci polici whatsapp clear air,1,0.3818
30,els got spam signalapp today list contact use app guy complet test releas product signalapp signal signalmesseng whatsapp privaci,8,-0.3612
31,digiv radar visit youtub channel http co rwv nokfd technew whatsapp appl http co lg wmx,6,0.0
32,use watusi io fouadraheb add new featur whatsapp messeng http co iern wbd,5,0.0
33,rt snowden wonder signalapp scale whatsapp decis sell user facebook led pro,4,0.0
34,rt privacyint whatsapp updat term forc user share data facebook suggest updat,1,0.296
35,theregist pleas excus said signalapp even imagin new workload whole india would switch whatsapp signal overnight,9,0.0
36,whatsapp telegram signalapp whatsapp whatsappprivacypolici whatsappprivaci,0,0.0
37,rt dan murphi whatsapp effect telegram surpass million activ user past hour alon million n,7,0.0
38,rt yadavshamita happen news sourc whatsapp inko bharat ratna pleas http co wncmkinqq,9,0.0
39,pray god give strength matter go may peac rule heart rise dlozilami lifeaftercovid whatsapp http co libfd cnwh,0,0.7717
40,use watusi io fouadraheb add new featur whatsapp messeng http co dcxfg lzu,5,0.0
41,rt zeenewsenglish signal see surg new user app better whatsapp signalapp whatsappprivacypolici htt,9,0.4404
42,rt razaazizaftab mobilink jazz pleas add signalapp instead whatsapp free panel whatsappprivacypolici whatsappnewpolici w,9,0.5106
43,use watusi io fouadraheb add new featur whatsapp messeng http co inukupddxh,5,0.0
44,use signalapp telegram give stupid polici whatsapp whatsappnewpolici,9,-0.5267
45,whatsapp monet user reason facebook paid billion let move folk http co dkzteu e,1,0.0
46,rt vinsinn make switch product own facebook noth arnabgoswami whatsapp facebook,1,0.0
47,rt kashmir watch andrabi administr mani whatsapp group amp also remain constant touch lashkar e jab,2,0.0
48,move telegram instead whatsapp http co bzcvadla,0,0.0
49,mark zuck invit accept verifi whatsapp like without permiss http co cfrqn ie,6,0.6249
50,zuckerberg say whatsapp threat appl imessag facebook ceo mark zuckerberg voic opinion appl privaci polici affect social media giant busi http co hawzuxfsya,1,-0.5267
51,rt mc phil care use gb whatsapp normal whatsapp repost whatsapp statu pictur without consent th,0,0.3682
52,way new privaci polici whatsapp came morn today whatsapp lick spit howev signalapp telegram continu run whatsappnewpolici whatsapp whatsappprivacypolici whatsappstatu http co vosodvabgn,0,0.0
53,rt strait time whatsapp updat term servic allow data share parent compani facebook prompt,1,0.4767
54,http co f ojaukl let thank god howev januari jan bachchanpandey coronavirusupd moseskuria whatsapp ruto,8,0.5574
55,whatsapp friday announc three month delay new privaci polici origin slate go effect februari th follow widespread backlash custom new polici whatsapp censorship freespeech privaci,8,-0.3182
56,good morn app privaci secur whatsapp onlin class onlin exam studentswantolineexam http co dnmvtwz nc,0,0.4404
57,two week year alreadi mani interview attend comment hr jobalert lagosjob jobsinlago abujajob job jobsearch jobsinabuja whatsapp whatsappjob,4,0.0
58,rt iamadnanchishti whatsapp delay new privaci polici till may compani want user understand new,8,-0.25
59,use watusi io fouadraheb add new featur whatsapp messeng http co zglbge ox,5,0.0
60,rt mr aalekh whatsapp new privaci polici peopl worri much data collect compar signal app telegram amp fac,9,0.0
61,signal app experienc remark growth due concern bigtech recent ban presid trump promin conserv growth spike even whatsapp put place controversi privaci term chang http co vyj,1,0.1531
62,rt thedeshbhakt leak whatsapp chat arnabgoswami make lot buzz big arnabg,7,-0.34
63,rt reacto day whatsapp want data proud share telegram work last version support w,8,0.8074
64,whatsapp new privaci polici roll back petit reach supremecourt http co qpjxosfsq,8,0.0258
65,share inform obligatori wife chink anyon whatsapp facebook sharinginfo shareyourwif http co xn urtn ii,1,0.296
66,rt dayzher honestli funniest pictori represent algorithm work whatsapp http co ckrfcufz,4,0.5574
67,top whatsapp altern app whatsappprivacypolici whatsapp whatsappaltern signalapp signal http co c olbb uyx,0,0.2023
68,rt thehackersnew whatsapp updat privaci polici term servic make data share facebook mandatori imp,1,0.296
69,use watusi io fouadraheb add new featur whatsapp messeng http co cfanjrprbb,5,0.0
70,rt ishantweetz instead use proprietari facebook garbag whatsapp start use signalmesseng complet opensourc secur pl,8,0.0
71,rt aditirav time delet whatsapp,0,0.0
72,first growth hack spam messag whatsapp inbox award goe cleartax lose long time fan http co rolh ag h,1,0.4939
73,use watusi io fouadraheb add new featur whatsapp messeng http co xko lhu fj,5,0.0
74,whatsapp final come faq clear confus claim read user privat chat user trust privaci polici mad mobileappdiari applic technolog whatsapp privacypolici digitalworld http co nhefoyogwi,8,0.4019
75,whatsapp flirt skypesex http co ex wumriqg,0,0.0
76,rt bobblekeyboard friend forev whatsapp group still exist still friend whatsapp friend friendsfor,8,0.8625
77,meanwhil whatsapp good question question hurt bro simpl think regist whatsapp account know,0,-0.128
78,get set hour fun cruserendezv w oapaynigeria amp squad talk big issu whatsapp kuda insm crash mark zuckerberg pm tunein also listen us anywher world visit http co pvj utsslv http co min n zlr,6,0.1531
79,rt patthemav hey appl time releas imessag facetim platform whatsappprivaci whatsapp http co piplqnyznq,1,0.0
80,whatsapp stop work agre new term privaci polici read updat term servic privaci polici http co fy gbl sh whatsappnewpolici whatsappprivaci http co adbsdjqw,8,-0.296
81,think news rule privaci whatsapp feel whatsapp work stop spread fals news rumour sometim turn violenc whatsapp whatsappprivacypolici whatsappnewpolici fakenew informationministri markzuckerberg,0,-0.296
82,use watusi io fouadraheb add new featur whatsapp messeng http co ehvm quqp,5,0.0
83,upcopay upco intern ist like appl googl amazon begin peopl realiz massiv potenti altern whatsapp upcopay includ fiat crypto relat telcom opportun,6,0.4939
84,wear work tomorrow want go nake biko wear fine shirt slay offic layconxfir bussitchalleng whatsapp gratefulforerica elonmusk ickcommand harrywearamask http co jqcpbhbp p,8,0.2732
85,founder whatsapp brian acton founder signal quit fb whatsapp bought fb decid monet whatsapp due breach contract fb waiv us million payoff suppos get fb,7,0.0
86,use watusi io fouadraheb add new featur whatsapp messeng http co jnyxoqqayx,5,0.0
87,mayb stingi boya broke ni return id card invest us invest bitcoin trade whatsappprivaci whatsapp http co olyp llm e,0,-0.4215
88,rt joewestbi fals choic face access onlin world either accept whatsapp new to delet account wh,0,0.3818
89,open whatsapp morn like http co qefgdfimmk,0,0.3612
90,rt yadavshamita happen news sourc whatsapp inko bharat ratna pleas http co wncmkinqq,9,0.0
91,rt yadavshamita happen news sourc whatsapp inko bharat ratna pleas http co wncmkinqq,9,0.0
92,si usa whatsapp esto te interesa http co bgdgzroo,0,0.0
93,rt ben aliyimm new updat whatsapp made creat big discuss area peopl care data privac,8,0.4939
94,anubhutimatta spoke bunch whatsapp altern across globe usp one claim respect user privaci mywickr jami social briarapp threemaapp wire troopmesseng spikenowhq divijualsuspect http co qxdpecnccc,8,0.4767
95,use watusi io fouadraheb add new featur whatsapp messeng http co uaehsofni,5,0.0
96,signalapp first time peopl read privacypolici understood meant privaci deletewhatsapp meanwhil whatsapp http co fwjwpphtjf,6,0.0
97,rt privacyint whatsapp updat term forc user share data facebook suggest updat,1,0.296
98,rt sanket whatsapp privaci polici watch full show http co ao xsqu h what,1,0.0
99,mega sale week backpack avail low price whatsapp order deliveri cost http co irhpvrbw w,0,-0.2732
100,sublim natur intens hair condition oliv oil hair mayonnais secret combin get healthi hair get today soulmateng haircar naturalbeauti naturalhairgeng haircondition mercyekeisavib whatsapp http co wnm nti ju,0,0.0
101,use watusi io fouadraheb add new featur whatsapp messeng http co fmmqkffk e,5,0.0
102,time exit whatsapp compromis data share facebook dataprivaci possibl myth tune pm hear acorn jiten jain amp sreenidhiv peopleseditor takshashilainst ikigailaw livestream http co crdhgjgjqj mukhia ji http co wo z c h f,1,0.296
103,rt thedeshbhakt anti goswami brigad predict end fall grace due whatsapp leak bhaktbanerj,3,-0.2263
104,pranavkasturi worri guy whatsapp never appli rule india watch http co gymurffcuf signalapp whatsappprivacypolici whatsappnewpolici,1,0.0
105,use watusi io fouadraheb add new featur whatsapp messeng http co dq yrwmj,5,0.0
106,use watusi io fouadraheb add new featur whatsapp messeng http co c q ksdwb,5,0.0
107,rt gabriela jca realli scare read new term condit whatsapp instagram goodby littl privaci,8,-0.4939
108,rt zaidtaqiuddin woww serious whatsapp whatsapp move telegram http co b szrwe,0,-0.0772
109,use watusi io fouadraheb add new featur whatsapp messeng http co uhgr n df,5,0.0
110,hour call souvikm signal solid stuff realli easi indian user abandon whatsapp privaci sure gonna make huge impact,8,0.3182
111,inform signal foundat creat whatsapp co founder brian acton signal messeng ceo moxi marlinspik acton left whatsapp donat million help fund signal http co nwfnkuqp,5,0.4019
112,unnecessari panic regret move whatsapp new whatsappprivacypolici signal loos tower rais,0,-0.7269
113,interest comparison forb major messag platform data privaci label io signalapp excel appl imessag good whatsapp umm facebook messeng wth even health fit liter pick privaci http co bmote bczn,1,0.7906
114,rt lowiqdetect uykulu uykulu zle meyi kabul edip twitter e girmi imdir whatsapp http co suucw wn,1,0.0
115,avail hot spici cam show camwithfac camindia sexi sologirl withfacecam stock facecam cammodel nudeshow sexybhabhi desigirl livecamgirl realcamgirl sex whatsapp indiancamgirl desicamgirl desicamshow camgirl sareeshow gujratigirl http co dvq hriobt,0,0.0
116,rt yadavshamita happen news sourc whatsapp inko bharat ratna pleas http co wncmkinqq,9,0.0
117,use watusi io fouadraheb add new featur whatsapp messeng http co yetx ezldb,5,0.0
118,rt mr aalekh whatsapp new privaci polici peopl worri much data collect compar signal app telegram amp fac,9,0.0
119,rt thehackersnew whatsapp updat privaci polici term servic make data share facebook mandatori imp,1,0.296
120,whatsapp whatsapp defer polici chang till march feel right signal power http co fjmdxkwszc,8,-0.296
121,mif whatsapp polici mani user pour anger meme amp declar switch telegram whatsappnewpolici telegram whatsappprivaci facebook whatsappprivacypolici http co fumn hdijh,0,-0.5719
122,long laugh never ceas amus famousquot quot mondaymotiv whatsapp whatsappstatu shareinspirequot,0,0.5574
123,whartonfintech insigniavc upco intern like appl googl amazon begin peopl realiz massiv potenti altern whatsapp upcopay includ fiat crypto relat telcom opportun isin ca mk mio cad,6,0.4939
124,privaci guy whatsappnewpolici like whatsapp whatsappprivaci whatsapppolici whatsappprivacypolici whatsappupd savukku privaci privacypolici http co qzlqxe ezl,1,0.3612
125,rt amitangshu never use whatsapp ever alway saw invas amp privaci violat tool india translat,4,0.0
126,app vs telegram vs signal follow techgalena stay updat latest technew turn post notif turn stori notif techgalena technew facebook signal whatsapp whatsappprivacypolici banwhatsapp privaci telegram http co twb x kad,0,0.0
127,rt haissamx ever happen autom whatsapp facebook privaci daysofcod nocod lowcod noprivaci autom http,1,0.0
128,whatsapp vs signal one prefer thescrbblr http co gp bllffcj,0,0.0
129,hey everyon receiv whatsappprivacypolici updat one receiv whatsappprivaci whatsapp whatsapppolici http co nqbhrbz ba,0,0.0
130,accord durov facebook entir depart devot figur telegram popular facebook whatsapp telegram http co tm eahuyxw,1,0.4215
131,govern respond whatsapp chat arnab barc partho dasgupta allegedli mention pm sr journalist sabanaqvi share view bhupendrachaub dilipthecherian drsyquraishi ashutosh b satksingh chintamanirao priyankac talktobhupen http co wfmuy f dd,0,0.296
132,war signalapp whatsapp telegram separ fan base,0,-0.3818
133,use watusi io fouadraheb add new featur whatsapp messeng http co tfple g zs,5,0.0
134,exclus interview ritvick ab senior congress leader prithvirajchavan rais question regard purport whatsapp chat arnabgoswami demand thorough investig matter read http co tkori wcp http co bpbmtkrrw,0,-0.1027
135,rt bookworm monk favorit switzerland iseltwald l tschental whatsappprivaci whatsappstatu whatsapp bitcoin,0,0.0
136,deathless liber mind lack cling famousquot quot mondaymotiv whatsapp whatsappstatu shareinspirequot,0,-0.3182
137,use watusi io fouadraheb add new featur whatsapp messeng http co dhw habag,5,0.0
138,use watusi io fouadraheb add new featur whatsapp messeng http co tfwze emc,5,0.0
139,whatsapp telegram wechat facebook instagram twitter air qualiti pollut citi rank januari http co kkveeqzjzm,1,0.0
140,whatsapp,0,0.0
141,rt hindu transcript whatsapp messag intercept via former barc ceo pratho dasgupta phone run,0,0.0
142,strong commun sent union minist shri rsprasad today caitindia reiter whatsapp must restrict implement new privaci polici amp technic audit whatsapp facebook amp instagram must conduct immedi secretarym ani http co xdlhyztqi,1,0.1779
143,use watusi io fouadraheb add new featur whatsapp messeng http co j kj gnr,5,0.0
144,rt officialnew similar whatsapp signal http co stzlgmojzv news tv technolog whatsapp signal similar,0,0.0
145,rt kashmir watch whatsapp ask user accept new whatsappprivacypolici share data facebook begi,1,0.5859
146,rt hindu transcript whatsapp messag intercept via former barc ceo pratho dasgupta phone run,0,0.0
147,alway user pay data metadata case free servic mishichoudhari http co zwauvsku r thetribunechd whatsappnewpolici whatsapp privaci dataprivaci,1,0.4404
148,rt thehackersnew bewar new wormabl android malwar spread automat whatsapp messag abus quick,5,0.0
149,anyon els ever ask confirm id facebook lockedout alert whatsapp btc bitcoin crypto altseason cryptonew http co wb dyqj,1,0.296
150,rt bdutt tavleen singh call like arnab goswami whatsapp shown king poodl es,0,0.3612
151,rt fsftamilnadu whatsapp internet monopoli christoph wyli chrisinsilico cambridgeanalytica whistleblow say,9,0.0
152,rt vardan use free product markzuckerberg whatsapp http co kxzuoisndt,4,0.5106
153,rt rudyshoushani join today pm vdl radio talk privaci whatsapp latest updat cybersecur http co,1,0.296
154,one perk live europ gdpr right friend tell still messag whatsapp even deletewhatsapp account need assist submit erasur person data request happi help http co fokzrtoao,0,0.7096
155,indian govern may call whatsapp explain new data privaci polici appli india europ whatsappprivaci http co vonw ksyin jainrounak http co l g yhd wc,8,0.0
156,stop use whatsapp use telegram,8,-0.296
157,elonmusk tell user move altern instant messag platform call signal whatsapp updat user privaci small comparison whatsapp signal app updat pp signalmesseng whatsappprivacypolici whatsappnewpolici http co zk gpcpsom,0,0.0
158,whatsapp group show googl search yet privaci theweek theweekl http co b xtealsxj,8,0.0
159,rt thehackersnew whatsapp updat privaci polici term servic make data share facebook mandatori imp,1,0.296
160,rt patel paresh summari arnab leak whatsapp chat arnabg arnabgoswami http co iepksgg ai,7,-0.34
161,rt perfectrizwan rubikaliyaquat arnabgoswamiexpos whatsapp mumbaipolic,0,0.0
162,rt yadavshamita happen news sourc whatsapp inko bharat ratna pleas http co wncmkinqq,9,0.0
163,use watusi io fouadraheb add new featur whatsapp messeng http co bgkc wrb,5,0.0
164,rt rkradhakrishn new condit impos whatsapp unaccept move platform read condit move away,8,0.0
165,rt snowden wonder signalapp scale whatsapp decis sell user facebook led pro,4,0.0
166,rt vardan use free product markzuckerberg whatsapp http co kxzuoisndt,4,0.5106
167,runner sell african print also place order inform whatsapp number price combo r whatsapp http co bccosmzfho,0,0.0772
168,think better come privaci whatsapp signal app like whatsapp rt signal http co gyal,0,0.6597
169,hoop slide must n slide clip work pierc n design left piec valentinesdaygift whatsapp wednesdaymotiv wednesdaythought valentinesday http co hccq stpb,8,0.0
170,rt zoo bear tomorrow signalapp come arnab goswami pic front page ad news paper whatsapp arnabg ek,0,0.0
171,rt bala ibb good even pal hoodi k kindli rt help locat custom whatsapp telegram kidd bussitchalleng en,0,0.6808
172,rt rohitroy leav whatsapp telegram markzuckerberg come buy telegram http co gkfxd c,0,0.0
173,rt ssrajputinc call record whatsapp,7,0.0
174,humbl request whatsapp polici wala document urdu main bj haamri awam ko smj nhi aa raha whatsappprivacypolici whatsapp telegrama,0,0.0
175,tire reason whatsapp,3,0.0
176,use watusi io fouadraheb add new featur whatsapp messeng http co aa xu sf,5,0.0
177,use watusi io fouadraheb add new featur whatsapp messeng http co sfig f fke,5,0.0
178,rt sanket whatsapp privaci polici watch full show http co ao xsqu h what,1,0.0
179,amid backlash user india whatsapp delay new privaci polici three month meanwhil user zuckerberg http co ugvggg oje,8,-0.3182
180,grasp limit reason true philosophi famousquot quot mondaymotiv whatsapp whatsappstatu shareinspirequot,0,0.4215
181,mobilink jazz pleas add signalapp instead whatsapp free panel whatsappprivacypolici whatsappnewpolici whatsappprivaci time switch,9,0.5106
182,interest articl latest secur amp privaci world instant messag ppl interest commun love stuff drbresso garyloew philat postalhistori text imessag whatsapp rutger princetonu http co ex iqxxqfr,1,0.8807
183,rt snowden wonder signalapp scale whatsapp decis sell user facebook led pro,4,0.0
184,hy twitter fam mani notic everybodi activ instagram whatsapp snapchat activ app twitter well believ everyon whose activ app creativ,0,0.2732
185,rt rafaybaloch reason signalapp secur whatsapp privaci secur signalapp whatsappprivacypolici http co,1,0.0
186,use watusi io fouadraheb add new featur whatsapp messeng http co erlhoamur,5,0.0
187,rt dptweet someon watch whatsappstatu whatsapp whatsapp headquart http co zrzwnjcg,0,0.0
188,whatsapp review term condit sapp polici whatsapp whatsappprivacypolici whatsapp whatsappnewpolici deletewhatsapp http co vk kw z nn,1,0.0
189,peopl plan delet whatsapp account move signal plan delet facebook instagram account,0,0.0
190,rt osman short accord new privaci polici whatsapp dont privaci anymor everi click whatsapp,8,0.0
191,rt snowden wonder signalapp scale whatsapp decis sell user facebook led pro,4,0.0
192,rt niiarrizabalaga top whatsapp altern thank new whatsappprivaci element matrix element hq matrixdotorg e e,8,0.5106
193,bother whatsapp privaci rule go chang us bother got know still object shall remain social dilemma live facebook busi,1,-0.6705
194,rt ashishatri like whatsapp think option signal switch telegram whatsapp whatsappprivaci h,0,0.3612
195,rt sanket someon somewher must learnt lesson two leak whatsapp chat come back bite realli hard,3,-0.4215
196,rt ssrajputinc call record whatsapp,7,0.0
197,signalapp beat whatsapp becom top free app app store india whatsappprivacypolici appstor trend http co ucj u e w,9,0.6249
198,rt sputnikint pakistani pm accus modi dirti nexu media top anchor leak whatsapp chat imrankhanpti naren,7,-0.1531
199,signalapp time say goodby whtasapp whatsappprivacypolici whatsapp telegram signalapp http co vzjqrkajx,9,0.0
200,rt snowden wonder signalapp scale whatsapp decis sell user facebook led pro,4,0.0
201,rt shriniketh whatsapp messag end end encrypt also whatsapp new polici whatsappprivaci http co kpdpj,0,0.0
202,rt strait time whatsapp updat term servic allow data share parent compani facebook prompt,1,0.4767
203,rt gossmotho toss whatsapp bin new cool thing know pay digit footprint,8,0.2263
204,freak whatsapp privacypolici mean drop devic got wakeup call valu inform data ai hello amazon googl appl microsoft softwar robot innov http co owvqn rg,6,-0.5106
205,peopl shift whatsapp telegram http co wtsai nyo,0,0.0
206,gravitasplu show wait alway best explan trend issu palkisu time whatsapp new privaci polici well think india need whatsapp,1,0.743
207,rt kasperski taken leap whatsapp fb messeng telegram boost privaci amp secur http co lxkp,1,0.4019
208,rt leader truth still understand whatapp new polici video clarifi thing whatsapp whatsapppriv,8,0.3182
209,user global instal signal sunday nearli fold compar download number januari day whatsapp updat privaci term accord data research firm apptopia whatsnewpolici whatsapp signal etribun http co phnfcqxod,8,0.0772
210,rt nivedanahta saw recent statu updat whatsapp think leak see fast delet messag c,0,-0.34
211,rt yadavshamita happen news sourc whatsapp inko bharat ratna pleas http co wncmkinqq,9,0.0
212,rt thehackersnew whatsapp updat privaci polici term servic make data share facebook mandatori imp,1,0.296
213,whatsapp whatsapp whatsappdelet deletewhatsapp uninstallwhatsapp boycottwhatsapp indian user delet whatsapp let make uniti privaci,8,0.0
214,rt xx network chaum fb collect data use whatsapp privaci facebook whatsapp zuckerberg tri fool peopl,1,-0.4404
215,insid stori signal becam privat messag app age fear distrust signal vs whatsapp http co bqfmkw kh,0,-0.7184
216,signal vs whatsapp mini saga messagingapp privaci secur goe view messagingapp http co qjryxbr sk,0,0.0
217,meanwhil uddhav thackeray arnab arnabgoswami republictv whatsapp uddhavthackeray meme http co bfauzzlnrw,0,0.0
218,rt khaleejtim popular messag app whatsapp jan clarifi new whatsappprivaci affect privaci user,8,0.4215
219,rt zeenewsenglish move whatsapp chat histori telegram know use migrat tool simpl step whatsapp telegr,0,0.0
220,propos chang whatsapp privaci polici rais grave concern withdrawn indian govt whatsapp ceo cathcart pti,8,-0.3818
221,whatsapp adopt new rule postpon month whatsapp facebook http co zjmg jx j,1,0.1779
222,whatsapp new privaci polici rajab tayyab erdogan media offic made big announc http co ceb yc n whatsapp erdogan,8,0.0
223,privaci polici onlin illeg consent broken new idea need love articl privaci whatsapp whatsappprivaci news http co u hx zdv via indianexpress,1,0.4588
224,rt meghupd take immedi cogniz ban whatsapp india confeder india trader cait strong letter,4,-0.0772
225,happen whatsapp,9,0.0
226,migrat whatsapp revolut knee jerk reaction rememb still facebook instagram realli move,1,-0.34
